{
  "schemaVersion": "1.0.0",
  "authoringVersion": "manual-qa-development-review-authoring/1.0.0",
  "status": "unreviewed",
  "warning": "UNREVIEWED CANDIDATE-BLIND MANUAL-QA PACKET: estimate manual validation, debugging, and hardening independently. Do not consult seed or candidate hours, category totals, repository totals, ratio formulas, or prior QA judgments.",
  "policy": {
    "id": "efforthours-manual-qa-development-review",
    "version": "manual-qa-development-review-policy/1.0.0",
    "digest": "sha256:bc4d9a29aac4fd80a917219c77a02dd0c8d1b71ecfb91d4f2b1ad287ecb231e0"
  },
  "sourceCorpus": {
    "id": "efforthours-public-readiness-development",
    "version": "0.3.0",
    "digest": "sha256:6ef79b8b950de013263258107c8c19cdd7187e66ab3be84107f63e282a76d385"
  },
  "rubric": {
    "id": "manual-qa-work-item",
    "version": "1.0.0"
  },
  "candidateVisibility": "blind",
  "sourceRecordId": "record:colinhacks-zod:implementation",
  "repository": {
    "id": "repository:github.com/colinhacks/zod",
    "name": "colinhacks/zod",
    "sourceDigest": "sha256:250432548197e4e8228d26209db94cff75d05ac1e2c34896ff2d2823f7e39fc5"
  },
  "source": {
    "dataClassification": "public-redistributable",
    "sourceReference": "https://github.com/colinhacks/zod",
    "revision": "3063993a3317ac8af7a244691b837fce3e53aa96",
    "licenseExpression": "MIT",
    "redistributionAllowed": true
  },
  "profile": "implementation",
  "baselineId": "senior-contractor-2026-no-ai",
  "partition": "development",
  "targets": [
    {
      "sourceTargetId": "target:work:application-entry-point:9b21971dcc7b3a4ca5f0:review-0001",
      "sourceLineageDigest": "sha256:e50bbe242da337fde7fe46c8e2c8829fa4d380cfddf38492ae83aa94f1189abe",
      "sourceCategory": "production-implementation",
      "title": "Implement application entry points for \u0027.\u0027 (application)",
      "scope": ".",
      "overlapGroupId": "manual-qa-overlap:f9e9ac35e86d73d74113",
      "evidenceIds": [
        "javascript:entry-point:scripts/write-stub-package-jsons.ts"
      ]
    },
    {
      "sourceTargetId": "target:work:application-entry-point:f25ddfcd30b1297bb331:review-0001",
      "sourceLineageDigest": "sha256:14f1fbd64fec2775d0d9de16f4e983bd24920222c305b46bbe0fccb74046ad5e",
      "sourceCategory": "production-implementation",
      "title": "Implement application entry points for \u0027.\u0027 (cli)",
      "scope": ".",
      "overlapGroupId": "manual-qa-overlap:f9e9ac35e86d73d74113",
      "evidenceIds": [
        "script:entry:shell:repository"
      ]
    },
    {
      "sourceTargetId": "target:work:javascript-source-backbone:2f5795bda39a0bae4a33:review-0001",
      "sourceLineageDigest": "sha256:68443cc0dbce8e40ffd4257b61b8b0d5a1341049175485decc417cc228ac34be",
      "sourceCategory": "production-implementation",
      "title": "Implement maintained internal logic for \u0027.\u0027 (application)",
      "scope": ".",
      "overlapGroupId": "manual-qa-overlap:f9e9ac35e86d73d74113",
      "evidenceIds": [
        "file:packages/docs-v3/.editorconfig",
        "file:packages/docs-v3/CODE_OF_CONDUCT.md",
        "file:packages/zod/LICENSE",
        "file:packages/zod/src/v4-mini/index.ts",
        "javascript:source-structure:."
      ]
    },
    {
      "sourceTargetId": "target:work:polyglot-source-backbone:9be033057a8e4093f293:review-0001",
      "sourceLineageDigest": "sha256:5479705277d6e7c47603f01a947065e7d46cc19205551614eca5e6843c5c9301",
      "sourceCategory": "production-implementation",
      "title": "Implement maintained internal logic for \u0027.\u0027 (cli)",
      "scope": ".",
      "overlapGroupId": "manual-qa-overlap:f9e9ac35e86d73d74113",
      "evidenceIds": [
        "script:source:shell:repository"
      ]
    },
    {
      "sourceTargetId": "target:work:ui-surface:918438cc13339fb696f4:review-0001",
      "sourceLineageDigest": "sha256:47488a84cdbb15975b6544da65720e5b1487bc49369f4637b68facfd142ae998",
      "sourceCategory": "ui-implementation-and-represented-ux-decisions",
      "title": "Implement represented UI and UX behavior for \u0027.\u0027 (application)",
      "scope": ".",
      "overlapGroupId": "manual-qa-overlap:f9e9ac35e86d73d74113",
      "evidenceIds": [
        "javascript:ui-asset:packages/docs-v3/blog/index.html",
        "javascript:ui-asset:packages/docs-v3/index.html"
      ]
    },
    {
      "sourceTargetId": "target:work:unit-tests:875ec9f8d2f4b23af140:review-0001",
      "sourceLineageDigest": "sha256:aba95b45ccde1371da3f99b48f9a81e9f03ed149706f19a4758d86f79074919a",
      "sourceCategory": "unit-testing",
      "title": "Create represented unit tests for \u0027.\u0027 (application)",
      "scope": ".",
      "overlapGroupId": "manual-qa-overlap:f9e9ac35e86d73d74113",
      "evidenceIds": [
        "javascript:test:packages/zod/src/v3/benchmarks/datetime.ts",
        "javascript:test:packages/zod/src/v3/benchmarks/ipv4.ts",
        "javascript:test:packages/zod/src/v3/tests/Mocker.ts",
        "javascript:test:packages/zod/src/v3/tests/all-errors.test.ts",
        "javascript:test:packages/zod/src/v3/tests/anyunknown.test.ts",
        "javascript:test:packages/zod/src/v3/tests/array.test.ts",
        "javascript:test:packages/zod/src/v3/tests/async-parsing.test.ts",
        "javascript:test:packages/zod/src/v3/tests/async-refinements.test.ts",
        "javascript:test:packages/zod/src/v3/tests/base.test.ts",
        "javascript:test:packages/zod/src/v3/tests/bigint.test.ts",
        "javascript:test:packages/zod/src/v3/tests/branded.test.ts",
        "javascript:test:packages/zod/src/v3/tests/catch.test.ts",
        "javascript:test:packages/zod/src/v3/tests/coerce.test.ts",
        "javascript:test:packages/zod/src/v3/tests/complex.test.ts",
        "javascript:test:packages/zod/src/v3/tests/custom.test.ts",
        "javascript:test:packages/zod/src/v3/tests/date.test.ts",
        "javascript:test:packages/zod/src/v3/tests/deepmasking.test.ts",
        "javascript:test:packages/zod/src/v3/tests/default.test.ts",
        "javascript:test:packages/zod/src/v3/tests/description.test.ts",
        "javascript:test:packages/zod/src/v3/tests/discriminated-unions.test.ts",
        "javascript:test:packages/zod/src/v3/tests/enum.test.ts",
        "javascript:test:packages/zod/src/v3/tests/error.test.ts",
        "javascript:test:packages/zod/src/v3/tests/firstparty.test.ts",
        "javascript:test:packages/zod/src/v3/tests/firstpartyschematypes.test.ts",
        "javascript:test:packages/zod/src/v3/tests/function.test.ts",
        "javascript:test:packages/zod/src/v3/tests/generics.test.ts",
        "javascript:test:packages/zod/src/v3/tests/instanceof.test.ts",
        "javascript:test:packages/zod/src/v3/tests/intersection.test.ts",
        "javascript:test:packages/zod/src/v3/tests/language-server.source.ts",
        "javascript:test:packages/zod/src/v3/tests/language-server.test.ts",
        "javascript:test:packages/zod/src/v3/tests/literal.test.ts",
        "javascript:test:packages/zod/src/v3/tests/map.test.ts",
        "javascript:test:packages/zod/src/v3/tests/masking.test.ts",
        "javascript:test:packages/zod/src/v3/tests/mocker.test.ts",
        "javascript:test:packages/zod/src/v3/tests/nan.test.ts",
        "javascript:test:packages/zod/src/v3/tests/nativeEnum.test.ts",
        "javascript:test:packages/zod/src/v3/tests/nullable.test.ts",
        "javascript:test:packages/zod/src/v3/tests/number.test.ts",
        "javascript:test:packages/zod/src/v3/tests/object-augmentation.test.ts",
        "javascript:test:packages/zod/src/v3/tests/object-in-es5-env.test.ts",
        "javascript:test:packages/zod/src/v3/tests/object.test.ts",
        "javascript:test:packages/zod/src/v3/tests/optional.test.ts",
        "javascript:test:packages/zod/src/v3/tests/parseUtil.test.ts",
        "javascript:test:packages/zod/src/v3/tests/parser.test.ts",
        "javascript:test:packages/zod/src/v3/tests/partials.test.ts",
        "javascript:test:packages/zod/src/v3/tests/pickomit.test.ts",
        "javascript:test:packages/zod/src/v3/tests/pipeline.test.ts",
        "javascript:test:packages/zod/src/v3/tests/preprocess.test.ts",
        "javascript:test:packages/zod/src/v3/tests/primitive.test.ts",
        "javascript:test:packages/zod/src/v3/tests/promise.test.ts",
        "javascript:test:packages/zod/src/v3/tests/readonly.test.ts",
        "javascript:test:packages/zod/src/v3/tests/record.test.ts",
        "javascript:test:packages/zod/src/v3/tests/recursive.test.ts",
        "javascript:test:packages/zod/src/v3/tests/refine.test.ts",
        "javascript:test:packages/zod/src/v3/tests/safeparse.test.ts",
        "javascript:test:packages/zod/src/v3/tests/set.test.ts",
        "javascript:test:packages/zod/src/v3/tests/standard-schema.test.ts",
        "javascript:test:packages/zod/src/v3/tests/string.test.ts",
        "javascript:test:packages/zod/src/v3/tests/transformer.test.ts",
        "javascript:test:packages/zod/src/v3/tests/tuple.test.ts",
        "javascript:test:packages/zod/src/v3/tests/unions.test.ts",
        "javascript:test:packages/zod/src/v3/tests/validations.test.ts",
        "javascript:test:packages/zod/src/v3/tests/void.test.ts",
        "javascript:test:packages/zod/src/v3/types.ts",
        "javascript:test:packages/zod/src/v4/classic/from-json-schema.ts",
        "javascript:test:packages/zod/src/v4/classic/schemas.ts",
        "javascript:test:packages/zod/src/v4/classic/tests/anyunknown.test.ts",
        "javascript:test:packages/zod/src/v4/classic/tests/apply.test.ts",
        "javascript:test:packages/zod/src/v4/classic/tests/array.test.ts",
        "javascript:test:packages/zod/src/v4/classic/tests/assignability.test.ts",
        "javascript:test:packages/zod/src/v4/classic/tests/async-parsing.test.ts",
        "javascript:test:packages/zod/src/v4/classic/tests/async-refinements.test.ts",
        "javascript:test:packages/zod/src/v4/classic/tests/base.test.ts",